<?xml version='1.0' encoding='utf-8'?>
<!DOCTYPE Library SYSTEM "LibraryDTD.dtd">
<Library>
  <User>
    <Name></Name>
    <Address></Address>
    <BooksRented>
      <Title></Title>
      <Author></Author>
      <Genre></Genre>
    </BooksRented>
  </User>
</Library>